item_id	path_type	path	bytes	sha16	depth	reason
IMPL_DCCB_LOOP-SKIP-001	directory	.claude	0	-	1	directory only contains skipped non-core files
IMPL_DCCB_LOOP-SKIP-002	directory	.claude-plugin	0	-	1	directory only contains skipped non-core files
IMPL_DCCB_LOOP-SKIP-003	file	.gitignore	158	d7c8344643ecae14	0	metadata only; not algorithm behavior
IMPL_DCCB_LOOP-SKIP-004	file	.claude-plugin/marketplace.json	425	7501066a50686e65	2	plugin packaging metadata; not core algorithm runtime or specification
IMPL_DCCB_LOOP-SKIP-005	file	.claude-plugin/plugin.json	742	d46e0b79f913574f	2	plugin packaging metadata; not core algorithm runtime or specification
IMPL_DCCB_LOOP-SKIP-006	file	.claude/CLAUDE.md	1123	1a3f9d9f0d0ef850	2	local assistant instruction surface; not repository algorithm behavior
